question,answer,category,difficulty,mode,question_type,choice_a,choice_b,choice_c,choice_d
"Number of municipalities Municipalities’ Responses to Inquiries about Potential Incentives for Firm 1,300 1,200 1,100 1,000 900 800 700 600 500 400 300 200 100 0 e iry ive ns t u o n p ce inq es n r o i dt no ed e r d e f n of po s re announcement before election announcement after election In the United States, firms often seek incentives from municipal governments to expand to those municipalities. A team of political scientists hypothesized that municipalities are much more likely to respond to firms and offer incentives if expansions can be announced in time to benefit local elected officials than if they can’t. The team contacted officials in thousands of municipalities, inquiring about incentives for a firm looking to expand and indicating that the firm would announce its expansion on a date either just before or just after the next election. Which choice best describes data from the graph that weaken the team’s hypothesis?",B,Reading and Writing,hard,sat,multiple_choice,A large majority of the municipalities that received an inquiry mentioning plans for an announcement before the next election didn’t respond to the inquiry.,The proportion of municipalities that responded to the inquiry or offered incentives didn’t substantially differ across the announcement timing conditions.,Only around half the municipalities that responded to inquiries mentioning plans for an announcement before the next election offered incentives.,"Of the municipalities that received an inquiry mentioning plans for an announcement date after the next election, more than 1,200 didn’t respond and only around 100 offered incentives."
"The most recent iteration of the immersive theater experience Sleep No More, which premiered in New York City in 2011, transforms its performance space—a five-story warehouse—into a 1930s-era hotel. Audience members, who wander through the labyrinthine venue at their own pace and follow the actors as they play out simultaneous, interweaving narrative loops, confront the impossibility of experiencing the production in its entirety. The play’s refusal of narrative coherence thus hinges on the sense of spatial fragmentation that the venue’s immense and intricate layout generates. What does the text most strongly suggest about Sleep No More’s use of its performance space?",C,Reading and Writing,hard,sat,multiple_choice,The choice of a New York City venue likely enabled the play’s creators to experiment with the use of theatrical space in a way that venues from earlier productions could not.,Audience members likely find the experience of the play disappointing because they generally cannot make their way through the entire venue.,The production’s dependence on a particular performance environment would likely make it difficult to reproduce exactly in a different theatrical space.,Audience members who navigate the space according to a recommended itinerary will likely have a better grasp of the play’s narrative than audience members who depart from that itinerary.
"During the World War II era, some Mexican American women adopted a striking new look called pachuca style. They wore altered men’s jackets or zoot suits (wide-legged, long-coated suits) and dramatic makeup, and they combed their hair into high, rounded shapes. Some people criticized pachuca style, saying it was dangerous and women should dress traditionally. But historians see things differently. They see pachuca style as a form of rebellion against the era’s rigid social expectations for women. They say that it showed a desire for self-expression and freedom on the part of women who adopted the style. According to the text, how do historians view pachuca style?",B,Reading and Writing,medium,sat,multiple_choice,They think that pachuca style was such a popular trend that it continues to influence fashion in the United States to the present day.,They think that pachuca style was a way for some Mexican American women to express themselves and resist strict social expectations.,They think that pachuca style was celebrated because it enabled some Mexican American women to show their support for the United States during World War II.,They think that pachuca style was similar to other fashion trends that different groups of women adopted in the same period.
"Utah is home to Pando, a colony of about 47,000 quaking aspen trees that all share a single root system. Pando is one of the largest single organisms by mass on Earth, but ecologists are worried that its growth is declining in part because of grazing by animals. The ecologists say that strong fences could prevent deer from eating young trees and help Pando start thriving again. According to the text, why are ecologists worried about Pando?",A,Reading and Writing,medium,sat,multiple_choice,It isn’t growing at the same rate it used to.,It isn’t producing young trees anymore.,It can’t grow into new areas because it is blocked by fences.,Its root system can’t support many more new trees.
"Although many transposons, DNA sequences that move within an organism’s genome through shuffling or duplication, have become corrupted and inactive over time, those from the long interspersed nuclear elements (LINE) family appear to remain active in the genomes of some species. In humans, they are functionally important within the hippocampus, a brain structure that supports complex cognitive processes. When the results of molecular analysis of two species of octopus—an animal known for its intelligence—were announced in 2022, the confirmation of a LINE transposon in Octopus vulgaris and Octopus bimaculoides genomes prompted researchers to hypothesize that that transposon family is tied to a species’ capacity for advanced cognition. Which finding, if true, would most directly support the researchers’ hypothesis?",A,Reading and Writing,medium,sat,multiple_choice,The LINE transposon in O. vulgaris and O. bimaculoides genomes is active in an octopus brain structure that functions similarly to the human hippocampus.,The human genome contains multiple transposons from the LINE family that are all primarily active in the hippocampus.,"A consistent number of copies of LINE transposons is present across the genomes of most octopus species, with few known corruptions.","O. vulgaris and O. bimaculoides have smaller brains than humans do relative to body size, but their genomes contain sequences from a wider variety of transposon families."
"To understand how temperature change affects microorganism-mediated cycling of soil nutrients in alpine ecosystems, Eva Kaštovská et al. collected plant-soil cores in the Tatra Mountains at elevations around 2,100 meters and transplanted them to elevations of 1,700–1,800 meters, where the mean air temperature was warmer by 2°C. Microorganism-mediated nutrient cycling was accelerated in the transplanted cores; crucially, microorganism community composition was unchanged, allowing Kaštovská et al. to attribute the acceleration to temperature-induced increases in microorganism activity. It can most reasonably be inferred from the text that the finding about the microorganism community composition was important for which reason?",C,Reading and Writing,hard,sat,multiple_choice,It provided preliminary evidence that microorganism-mediated nutrient cycling was accelerated in the transplanted cores.,It suggested that temperature-induced changes in microorganism activity may be occurring at increasingly high elevations.,It ruled out a potential alternative explanation for the acceleration in microorganism-mediated nutrient cycling.,It clarified that microorganism activity levels in the plant-soil cores varied depending on which microorganisms comprised the community.
"Jean-Bernard Caron and colleagues recently discovered a cache of jellyfish fossils in the Burgess Shale, a site in the Canadian Rockies that is rich in fossils from the Cambrian period (over 500 million years ago). Caron and colleagues claim that these are the oldest jellyfish fossils ever discovered. In the past twenty years, two sites in China and the United States have yielded fossils of a similar age that some experts believe are most likely jellyfish due to their shapes and the appearance of projecting tentacles. But Caron and colleagues argue that the apparent tentacles are in fact the comb rows of ctenophores, gelatinous animals that are only distantly related to jellyfish. Which statement, if true, would most directly weaken the claim by Caron and colleagues about the fossils found in China and the United States?",B,Reading and Writing,hard,sat,multiple_choice,Sites in the Canadian Rockies from later periods than the Cambrian period have yielded fossils that have been conclusively identified as ctenophore fossils.,"The fossils found in China and the United States are so poorly preserved that though they cannot be conclusively identified as jellyfish, they cannot be conclusively identified as ctenophores either.","While ctenophore fossils have been discovered in China and the United States, they have never been discovered in the Burgess Shale.",The fossils discovered by Caron and colleagues in the Burgess Shale were better preserved than the fossils discovered by other researchers in China and the United States.
"The following text is from Jane Austen’s 1811 novel Sense and Sensibility. Elinor lives with her younger sisters and her mother, Mrs. Dashwood. Elinor, this eldest daughter, whose advice was so effectual, possessed a strength of understanding, and coolness of judgment, which qualified her, though only nineteen, to be the counsellor of her mother, and enabled her frequently to counteract, to the advantage of them all, that eagerness of mind in Mrs. Dashwood which must generally have led to imprudence. She had an excellent heart;—her disposition was affectionate, and her feelings were strong; but she knew how to govern them: it was a knowledge which her mother had yet to learn; and which one of her sisters had resolved never to be taught. According to the text, what is true about Elinor?",D,Reading and Writing,easy,sat,multiple_choice,Elinor often argues with her mother but fails to change her mind.,Elinor can be overly sensitive with regard to family matters.,Elinor thinks her mother is a bad role model.,Elinor is remarkably mature for her age.
"Sample of Food Items from Gemini Mission Menus Food item Day Meal Sugar cookie cubes 1 B Chicken and vegetables 2 B Shrimp cocktail 4 C Hot cocoa 3 A To make sure they got the nutrition they needed while in space, the astronauts of NASA’s Gemini missions were given menus for three meals a day (meals A, B, and C) on a four-day rotating schedule. Looking at the sample of food items from these menus, a student notes that on day 1, the menu included ______ Which choice most effectively uses data from the table to complete the statement?",C,Reading and Writing,easy,sat,multiple_choice,shrimp cocktail for meal B.,hot cocoa for meal C.,sugar cookie cubes for meal B.,chicken and vegetables for meal A.
"Many literary theorists distinguish between fabula, a narrative’s content, and syuzhet, a narrative’s arrangement and presentation of events. In the film The Godfather Part II, the fabula is the story of the Corleone family, and the syuzhet is the presentation of the story as it alternates between two timelines in 1901 and 1958. But literary theorist Mikhail Bakhtin maintained that fabula and syuzhet are insufficient to completely describe a narrative—he held that systematic categorizations of artistic phenomena discount the subtle way in which meaning is created by interactions between the artist, the work, and the audience. Which choice best states the main idea of the text?",A,Reading and Writing,hard,sat,multiple_choice,Literary theorist Mikhail Bakhtin argued that there are important characteristics of narratives that are not fully encompassed by two concepts that other theorists have used to analyze narratives.,Literary theorist Mikhail Bakhtin claimed that meaning is not inherent in a narrative but is created when an audience encounters a narrative so that narratives are interpreted differently by different people.,"The storytelling methods used in The Godfather Part II may seem unusually complicated, but they can be easily understood when two concepts from literary theory are utilized.",Narratives that are told out of chronological order are more difficult for audiences to understand than are narratives presented chronologically.
"Biologists have predicted that birds’ feather structures vary with habitat temperature, but this hadn’t been tested in mountain environments. Ornithologist Sahas Barve studied feathers from 249 songbird species inhabiting different elevations—and thus experiencing different temperatures—in the Himalaya Mountains. He found that feathers of high-elevation species not only have a greater proportion of warming downy sections to flat and smooth sections than do feathers of low-elevation species, but highelevation species’ feathers also tend to be longer, providing a thicker layer of insulation. Which choice best states the main idea of the text?",B,Reading and Writing,medium,sat,multiple_choice,"Barve’s investigation shows that some species of Himalayan songbirds have evolved feathers that better regulate body temperature than do the feathers of other species, contradicting previous predictions.","Barve found an association between habitat temperature and feather structure among Himalayan songbirds, lending new support to a general prediction.","Barve discovered that songbirds have adapted to their environment by growing feathers without flat and smooth sections, complicating an earlier hypothesis.","The results of Barve’s study suggest that the ability of birds to withstand cold temperatures is determined more strongly by feather length than feather structure, challenging an established belief."
"The ancient Greek concept of “mimesis,” a term used in the works of Plato, Aristotle, and other Greek philosophers in discussions of representational art—visual, performance, or literary art that aims to depict the real world—is a foundational concept of the Western philosophy of aesthetics. Mimesis is typically translated as “imitation” in modern editions of ancient Greek texts, but scholar Stephen Halliwell warns that this is overly reductive: “imitation” implies that art merely copies—and is thus by definition entirely derivative of—a reality that exists outside and prior to the work of art, and translating “mimesis” thusly obscures the multifaceted ways in which the ancient Greeks understood the relationship between art and reality. Which statement, if true, would most directly support the claim by Halliwell presented in the text?",D,Reading and Writing,hard,sat,multiple_choice,"One of the earliest appearances of mimesis’s root word, mimos, can be found in an ancient Greek tragedy in reference to dramatic impersonation, and the mim- root came to be generally associated with the musical and poetic arts by the fifth century BCE.",Both Plato’s and Aristotle’s theorizations of mimesis examine the psychological effects that works of art induce in the viewer or listener.,"Although several of Plato’s earliest philosophical works discuss aesthetic ideas, the term “mimesis” doesn’t appear in Plato’s discussions of art until Cratylus, a relatively late work.","Although Plato’s writings typically characterize representational art as an inferior reflection of the physical world, Aristotle suggests that mimesis can refer to art’s capacity to envision hypothetical conditions that could, but don’t yet, exist."
"Economic Policy Uncertainty in the United Kingdom, 2005–2010 200 150 100 50 0 05 06 07 08 09 10 20 20 20 20 20 20 Year tax and public spending policy trade policy general economic policy High levels of public uncertainty about which economic policies a country will adopt can make planning difficult for businesses, but measures of such uncertainty have not tended to be very detailed. Recently, however, economist Sandile Hlatshwayo analyzed trends in news reports to derive measures not only for general economic policy uncertainty but also for uncertainty related to specific areas of economic policy, like tax or trade policy. One revelation of her work is that a general measure may not fully reflect uncertainty about specific areas of policy, as in the case of the United Kingdom, where general economic policy uncertainty ______ Which choice most effectively uses data from the graph to illustrate the claim?",D,Reading and Writing,hard,sat,multiple_choice,aligned closely with uncertainty about tax and public spending policy in 2005 but differed from uncertainty about tax and public spending policy by a large amount in 2009.,was substantially lower than uncertainty about tax and public spending policy each year from 2005 to 2010.,reached its highest level between 2005 and 2010 in the same year that uncertainty about trade policy and tax and public spending policy reached their lowest levels.,was substantially lower than uncertainty about trade policy in 2005 and substantially higher than uncertainty about trade policy in 2010.
"Number of lizard species Number of Lizard Species by Average Percent of Maximal Speed Used When Pursuing Prey or Escaping Predators 9 8 7 6 5 4 3 2 1 0 39 –49 –59 –69 –79 –89 100 – 30 40 50 60 70 80 90– Percent of maximal speed escaping pursuing It may seem that the optimal strategy for an animal pursuing prey or escaping predators is to move at maximal speed, but the energy expense of exploiting full speed capacity can disfavor such a strategy even in escape contexts, as evidenced by the fact that ______ Which choice most effectively uses data from the graph to complete the text?",B,Reading and Writing,hard,sat,multiple_choice,most lizard species use about the same percentage of their maximal speed when escaping predation as they do when pursuing prey.,multiple lizard species move at an average of less than 90% of their maximal speed while escaping predation.,"more lizard species use, on average, 90%–100% of their maximal speed while escaping predation than use any other percentage of their maximal speed.","at least 4 lizard species use, on average, less than 100% of their maximal speed while pursuing prey."
"Area (square meters) Characteristics of the Banks of the Provo River Downstream of the Jordanelle Dam 140,000 120,000 100,000 80,000 60,000 40,000 20,000 0 1987 1993 2006 Year grass cover bare soil forest cover The Jordanelle Dam was built on the Provo River in Utah in 1992. Earth scientist Adriana E. Martinez and colleagues tracked changes to the environment on the banks of the river downstream of the dam, including how much grass and forest cover were present. They concluded that the dam changed the flow of the river in ways that benefited grass plants but didn’t benefit trees. Which choice best describes data from the graph that support Martinez and colleagues’ conclusion?",D,Reading and Writing,medium,sat,multiple_choice,"The lowest amount of grass cover was approximately 58,000 square meters, and the highest amount of forest cover was approximately 75,000 square meters.","There was more grass cover than forest cover in 1987, and this difference increased dramatically in 1993 and again in 2006.","There was less grass cover than bare soil in 1987 but more grass cover than bare soil in 1993 and 2006, whereas there was more forest cover than bare soil in all three years.","Grass cover increased from 1987 to 1993 and from 1993 to 2006, whereas forest cover decreased in those periods."
"The practice of logging (cutting down trees for commercial and other uses) is often thought to be at odds with forest conservation (the work of preserving forests). However, a massive study in forest management and preservation spanning 700,000 hectares in Oregon’s Malheur National Forest calls that view into question. So far, results of the study suggest that forest plots that have undergone limited logging (the careful removal of a controlled number of trees) may be more robust than plots that haven’t been logged at all. These results, in turn, suggest that ______ Which choice most logically completes the text?",A,Reading and Writing,medium,sat,multiple_choice,"logging may be useful for maintaining healthy forests, provided it is limited.",other forest management strategies are more effective than limited logging.,"as time passes, it will be difficult to know whether limited logging has any benefits.",the best way to support forest health may be to leave large forests entirely untouched.
"When fashion designer Lloyd Henri Kiva New opened his store in Scottsdale, Arizona, in 1945, he quickly became known for creating delicately crafted leather goods, like belts and hats. He was perhaps most renowned for his colorful handbags, which he made by hand using a long and painstaking process. As he gained more customers, New began using sewing machines and other tools to help him produce bags more efficiently, though he continued to handcraft the crucial details that made each bag unique. Based on the text, what would have been the most likely consequence if New had not begun using sewing machines?",B,Reading and Writing,easy,sat,multiple_choice,"He would have been unable to ensure that each bag included unique, handcrafted details.",He would have struggled to meet the increasing demand for his bags.,He would have had to individually design each bag he produced.,He would not have been able to generate as much interest in his bags.
"Land Area Covered by Native Flowering Plants at a Site in Antarctica Species Area covered in 2009 (in Area covered in 2018 (in Percent increase in area covered square meters) square meters) from 2009 to 2018 1,230 1,576 28% 6.9 10.7 55% Deschampsia antarctica Colobanthus quitensis The only flowering plant species native to Antarctica, Colobanthus quitensis and Deschampsia antarctica grow in places where the earth remains free of ice for much of the year. Botanist Niccoletta Cannone wondered how the warming of Antarctica’s climate in recent years had affected these species, so she visited a site in Antarctica, first in 2009 and later in 2018, to count the number of plants growing there. Cannone found that the area of land covered by the two species had significantly expanded during the nineyear period. While both species likely benefited from warming temperatures, Colobanthus quitensis ______ Which choice most effectively uses data from the table to complete the comparison?",B,Reading and Writing,medium,sat,multiple_choice,"suppressed the growth of Deschampsia antarctica, which covered a smaller area of land in 2018 than it had in 2009.","saw a greater expansion than Deschampsia antarctica did, increasing the area of land it covered by more than half.",showed a greater increase in the average size of individual plants than Deschampsia antarctica did.,covered land newly freed from ice at a rate 55% faster than that of Deschampsia antarctica.
"Artist Marilyn Dingle’s intricate, coiled baskets are ______ sweetgrass and palmetto palm. Following a Gullah technique that originated in West Africa, Dingle skillfully winds a thin palm frond around a bunch of sweetgrass with the help of a “sewing bone” to create the basket’s signature look that no factory can reproduce. Which choice completes the text with the most logical and precise word or phrase?",B,Reading and Writing,easy,sat,multiple_choice,indicated by,handmade from,represented by,collected with
"The invention in 1958 of the integrated circuit (or microchip) radically altered the semiconductor industry. In fact, some historians argue that it fundamentally ______ the industry by enabling it to take advantage of mass production methods for the first time. Which choice completes the text with the most logical and precise word or phrase?",D,Reading and Writing,easy,sat,multiple_choice,overwhelmed,bypassed,obstructed,transformed
Botanist Al Kovaleski has pointed out that maple trees already thrive in a wide variety of climates and thus may ______ changes in climate better than some other tree species do. The alterations maples may undergo in response to a changing climate are likely to be relatively small and easily achieved. Which choice completes the text with the most logical and precise word or phrase?,D,Reading and Writing,easy,sat,multiple_choice,relocate from,refer to,originate from,adapt to
"The following text is adapted from Nathaniel Hawthorne’s 1837 story “Dr. Heidegger’s Experiment.” The main character, a physician, is experimenting with rehydrating a dried flower. At first [the rose] lay lightly on the surface of the fluid, appearing to imbibe none of its moisture. Soon, however, a singular change began to be visible. The crushed and dried petals stirred and assumed a deepening tinge of crimson, as if the flower were reviving from a deathlike slumber. As used in the text, what does the phrase “a singular” most nearly mean?",D,Reading and Writing,medium,sat,multiple_choice,A lonely,A disagreeable,An acceptable,An extraordinary
"Rejecting the premise that the literary magazine Ebony and Topaz (1927) should present a unified vision of Black American identity, editor Charles S. Johnson fostered his contributors’ diverse perspectives by promoting their authorial autonomy. Johnson’s selfeffacement diverged from the editorial stances of W.E.B. Du Bois and Alain Locke, whose decisions for their publications were more ______. Which choice completes the text with the most logical and precise word or phrase?",B,Reading and Writing,hard,sat,multiple_choice,proficient,dogmatic,ambiguous,unpretentious
